{
  "id": "backend-ref-martin-fowler-monolith-first",
  "title": "Martin Fowler Monolith First",
  "domain": "backend",
  "category": "architecture",
  "source": {
    "name": "Martin Fowler",
    "url": "https://martinfowler.com/bliki/MonolithFirst.html",
    "source_type": "architecture_case"
  },
  "captured_at": "2026-04-29",
  "summary": "Monolith First 是个人和早期项目默认模块化单体的重要架构背景。",
  "key_points": [
    "先用单体验证边界。",
    "微服务需要团队和运维成熟度。"
  ],
  "applicable_scenarios": [
    "后端架构",
    "个人项目"
  ],
  "avoid_when": [
    "明确多团队独立部署需求"
  ],
  "implementation_notes": [
    "作为架构原则入口，不复制全文。"
  ],
  "agent_usage": {
    "when_to_use": [
      "后端架构",
      "个人项目"
    ],
    "how_to_apply": [
      "把该 reference 当检索入口，结合本地 rules/templates 使用。",
      "不要假装已经完整读取外部文档全文；需要精确条款时再打开官方来源。"
    ],
    "code_generation_rules": [
      "生成代码时优先采用本地 rules 的保守默认。",
      "不要复制 secret、源码或外部文档原文。"
    ]
  },
  "retrieval": {
    "prompt_tags": [
      "Monolith First",
      "模块化单体",
      "backend architecture",
      "backend",
      "后端",
      "architecture"
    ],
    "keywords": [
      "Monolith First",
      "模块化单体",
      "backend architecture",
      "backend architecture",
      "后端架构",
      "API design",
      "接口设计",
      "database design",
      "数据库设计",
      "后端安全",
      "Docker deployment",
      "Docker 部署",
      "AI backend",
      "AI 应用后端"
    ]
  },
  "related_rules": [
    "rules/backend-engineering-map.md"
  ],
  "related_topics": [
    "wiki/topics/modern-backend-architecture.md"
  ]
}
