{
  "id": "backend-ref-twelve-factor-app",
  "title": "Twelve-Factor App",
  "domain": "backend",
  "category": "deployment",
  "source": {
    "name": "The Twelve-Factor App",
    "url": "https://12factor.net/",
    "source_type": "architecture_case"
  },
  "captured_at": "2026-04-29",
  "summary": "Twelve-Factor App 是配置、依赖、日志和部署边界的工程参考入口。",
  "key_points": [
    "配置通过环境变量。",
    "日志输出和进程模型清晰。"
  ],
  "applicable_scenarios": [
    "部署",
    "环境变量"
  ],
  "avoid_when": [
    "纯本地脚本"
  ],
  "implementation_notes": [
    "本地规则要求 secret 示例使用明显占位符。"
  ],
  "agent_usage": {
    "when_to_use": [
      "部署",
      "环境变量"
    ],
    "how_to_apply": [
      "把该 reference 当检索入口，结合本地 rules/templates 使用。",
      "不要假装已经完整读取外部文档全文；需要精确条款时再打开官方来源。"
    ],
    "code_generation_rules": [
      "生成代码时优先采用本地 rules 的保守默认。",
      "不要复制 secret、源码或外部文档原文。"
    ]
  },
  "retrieval": {
    "prompt_tags": [
      "Twelve-Factor",
      "environment variables",
      "环境变量",
      "backend",
      "后端",
      "deployment"
    ],
    "keywords": [
      "Twelve-Factor",
      "environment variables",
      "环境变量",
      "backend architecture",
      "后端架构",
      "API design",
      "接口设计",
      "database design",
      "数据库设计",
      "后端安全",
      "Docker deployment",
      "Docker 部署",
      "AI backend",
      "AI 应用后端"
    ]
  },
  "related_rules": [
    "rules/deployment-and-env-rules.md"
  ],
  "related_topics": [
    "wiki/topics/docker-env-deployment.md"
  ]
}
