{
  "id": "backend-ref-prometheus-grafana",
  "title": "Prometheus Grafana",
  "domain": "backend",
  "category": "observability",
  "source": {
    "name": "Prometheus Docs",
    "url": "https://prometheus.io/docs/introduction/overview/",
    "source_type": "observability_doc"
  },
  "captured_at": "2026-04-29",
  "summary": "Prometheus/Grafana 是后端指标采集和可视化的常用参考入口。",
  "key_points": [
    "适合请求耗时、错误率、队列失败、DB 状态。"
  ],
  "applicable_scenarios": [
    "metrics",
    "监控"
  ],
  "avoid_when": [
    "无需上线的 demo"
  ],
  "implementation_notes": [
    "小项目可先保守启用基础 metrics。"
  ],
  "agent_usage": {
    "when_to_use": [
      "metrics",
      "监控"
    ],
    "how_to_apply": [
      "把该 reference 当检索入口，结合本地 rules/templates 使用。",
      "不要假装已经完整读取外部文档全文；需要精确条款时再打开官方来源。"
    ],
    "code_generation_rules": [
      "生成代码时优先采用本地 rules 的保守默认。",
      "不要复制 secret、源码或外部文档原文。"
    ]
  },
  "retrieval": {
    "prompt_tags": [
      "Prometheus",
      "Grafana",
      "metrics",
      "监控",
      "backend",
      "后端",
      "observability"
    ],
    "keywords": [
      "Prometheus",
      "Grafana",
      "metrics",
      "监控",
      "backend architecture",
      "后端架构",
      "API design",
      "接口设计",
      "database design",
      "数据库设计",
      "后端安全",
      "Docker deployment",
      "Docker 部署",
      "AI backend",
      "AI 应用后端"
    ]
  },
  "related_rules": [
    "rules/performance-and-stability-rules.md"
  ],
  "related_topics": [
    "wiki/topics/logging-error-handling-observability.md"
  ]
}
